{
  "$schema": "../../schemas/mythic-spell-variant.schema.json",
  "schema_version": "0.1.0",
  "mythic_spell_variant_id": "mythic-spell-variant.hex-ward",
  "ruleset": "Pathfinder First Edition",
  "name": "Mythic Hex Ward",
  "base_spell": {
    "spell_id": "spell.hex-ward",
    "relationship": "mythic_version_of",
    "rules_combination": "inherits_unless_replaced",
    "evidence": [
      {
        "observation_id": "aon:spell.hex-ward:f54c1c433dcc448d",
        "source_field": "raw_aon_mythic_section",
        "evidence_kind": "plain_text",
        "anchor_text_raw": "Mythic Hex Ward",
        "source_href": "https://www.aonprd.com/SpellDisplay.aspx?ItemName=Hex+Ward"
      }
    ]
  },
  "rules_text": {
    "raw": "The target gains immunity to one witch hex (but not a major hex or grand hex) of your choice.",
    "search_text": "The target gains immunity to one witch hex (but not a major hex or grand hex) of your choice."
  },
  "augmentations": [
    {
      "augmentation_id": "mythic-spell-variant.hex-ward.augmentation-3",
      "name": "Augmented (3rd)",
      "minimum_tier": 3,
      "total_mythic_power_uses": null,
      "raw": "If you expend two uses of mythic power, instead of granting immunity to one witch hex, you can grant immunity to two hexes or one major hex. If you’re at least 6th tier and expend three uses of mythic power, you instead grant immunity to three hexes, two major hexes, or one grand hex.",
      "relationships": []
    }
  ],
  "publication": {
    "publisher": "Paizo",
    "book": "Mythic Adventures",
    "page": 98,
    "first_party_status": "confirmed"
  },
  "relationships": [],
  "provenance": [
    {
      "field_path": "/rules_text/raw",
      "observation_id": "aon:spell.hex-ward:f54c1c433dcc448d",
      "source_field": "raw_aon_mythic_section",
      "decision": "copied",
      "note": "AoN mythic subsection copied after its source citation."
    },
    {
      "field_path": "/publication",
      "observation_id": "aon:spell.hex-ward:f54c1c433dcc448d",
      "source_field": "raw_aon_mythic_section",
      "decision": "normalized",
      "note": "Publication citation separated from the mythic rules text."
    }
  ],
  "normalization": {
    "status": "draft",
    "normalizer_version": "mythic-draft-0.1.0",
    "warnings": [
      {
        "code": "MYTHIC_EFFECT_MODEL_DEFERRED",
        "field_path": "/rules_text",
        "message": "Mythic effects remain source-backed rules text pending a reusable structured effect model."
      },
      {
        "code": "MYTHIC_POWER_COST_VARIABLE",
        "field_path": "/augmentations",
        "message": "The augmentation has alternative, repeated, or scaled mythic-power costs; raw text is preserved pending a cost-expression model."
      }
    ]
  }
}
